{
  "$schema": "http://json-schema.org/draft-07/schema#",
  "$id": "https://tensorplate.com/schemas/v0.1/platform_support_row.json",
  "title": "TensorPlate Platform Support Row",
  "description": "One platform support row: the unit the registry stores, `doctor` matches against, and release evidence is filed under. Accelerator rows match an exact SKU by default; a narrowly defined family row can provide a lower-priority compatibility envelope, while an exact row always wins. Other fields remain exact-version, so evidence never transfers between rows. Non-exact future targets use the separate roadmap_target.json schema and are never rows. Memory accounting references the platform memory profile records by property name (`unified_memory` / `discrete_gpu`) rather than re-specifying them. This schema versions independently of the cross-process protocol; consumers reject other schema_version values as static-config errors. Free-text fields must also carry a non-whitespace character; that rule is enforced by consumers rather than by a `pattern`, because regex dialects disagree about which code points count as whitespace (U+FEFF and U+3000 among them) and a cross-language contract must not depend on that.",
  "type": "object",
  "additionalProperties": false,
  "required": [
    "schema_version",
    "row_id",
    "os",
    "kernel_driver_stack",
    "cpu",
    "backend_packages",
    "model_class_rows",
    "gate_semantics",
    "support_level",
    "validation_environment",
    "provenance"
  ],
  "properties": {
    "schema_version": {
      "type": "string",
      "const": "0.1"
    },
    "row_id": {
      "type": "string",
      "minLength": 1,
      "pattern": "^[a-z0-9]+(-[a-z0-9]+)*$",
      "description": "Stable identifier, unique across the registry. Lowercase alphanumeric segments joined by single hyphens so identifier resolution is unambiguous."
    },
    "os": {
      "type": "object",
      "additionalProperties": false,
      "required": [
        "name",
        "version"
      ],
      "properties": {
        "name": {
          "type": "string",
          "minLength": 1
        },
        "version": {
          "type": "string",
          "minLength": 1,
          "description": "Exact OS version. Evidence from one version never satisfies another."
        },
        "image_identity": {
          "type": "string",
          "minLength": 1,
          "description": "Image or distribution identity where the OS version alone is not exact (e.g. a JetPack/L4T release on an Ubuntu base)."
        }
      }
    },
    "kernel_driver_stack": {
      "type": "object",
      "additionalProperties": false,
      "required": [
        "components"
      ],
      "properties": {
        "components": {
          "type": "array",
          "description": "Kernel, driver and runtime component versions admission requires the host to report (accelerator driver, compute runtime, inference runtime, Python, framework; or OS build plus framework on Apple rows). The agent reports no components, so a declared one is absent on every host and admission refuses every deploy: rows declare an empty list, and an evidence run records the measured stack in the row's evidence bundle instead.",
          "items": {
            "type": "object",
            "additionalProperties": false,
            "required": [
              "component",
              "version"
            ],
            "properties": {
              "component": {
                "type": "string",
                "minLength": 1,
                "pattern": "^[a-z0-9]+(_[a-z0-9]+)*$",
                "description": "Vendor-neutral component identifier in lower_snake_case."
              },
              "version": {
                "type": "string",
                "minLength": 1
              }
            }
          }
        }
      }
    },
    "cpu": {
      "type": "object",
      "additionalProperties": false,
      "required": [
        "architecture",
        "vendors"
      ],
      "properties": {
        "architecture": {
          "type": "string",
          "enum": [
            "x86_64",
            "arm64"
          ]
        },
        "vendors": {
          "type": "array",
          "minItems": 1,
          "uniqueItems": true,
          "description": "Host CPU vendors this row covers. A row with an accelerator names exactly one, because the accelerator SKU pins the host; an accelerator-less utility row may cover several. Drives `unsupported_cpu_vendor` by membership, with no out-of-band allowlist.",
          "items": {
            "type": "string",
            "enum": [
              "amd",
              "intel",
              "apple",
              "nvidia_soc"
            ]
          }
        }
      }
    },
    "accelerator": {
      "type": "object",
      "additionalProperties": false,
      "required": [
        "family",
        "sku",
        "memory_bytes",
        "memory_profile",
        "partitioning"
      ],
      "description": "Absent on accelerator-less rows. Exact SKU matching is the default; a family policy is a lower-priority compatibility envelope.",
      "properties": {
        "family": {
          "type": "string",
          "minLength": 1
        },
        "sku": {
          "type": "string",
          "minLength": 1,
          "description": "Exact SKU as reported by the platform, or the canonical family name when match_policy is `family`."
        },
        "match_policy": {
          "type": "string",
          "enum": [
            "exact",
            "family"
          ],
          "default": "exact",
          "description": "Matching policy. `exact` is the default. `family` is reserved for the Apple M-series compatibility envelope and loses to an exact row."
        },
        "memory_bytes": {
          "type": "integer",
          "minimum": 1,
          "maximum": 9007199254740991,
          "description": "Accelerator memory size in bytes; must be positive. Integers in [0, 2^53) so a declared size can never be silently rounded by a JSON parser."
        },
        "memory_profile": {
          "type": "string",
          "enum": [
            "unified_memory",
            "discrete_gpu"
          ],
          "description": "Reference to the platform memory profile record of the same property name; the profile owns budget domains, measurement sources, and headroom computation."
        },
        "device_count": {
          "type": "integer",
          "minimum": 1,
          "maximum": 4294967295,
          "default": 1,
          "description": "How many accelerators of this SKU the row claims. Absent means one, so every row written before topology existed keeps its meaning and no fixture changes. A row claims a topology, not just silicon: evidence collected on one card does not carry to eight of them, so a host whose count differs matches no row rather than matching on SKU alone."
        },
        "partitioning": {
          "type": "string",
          "enum": [
            "unsupported",
            "not_applicable"
          ],
          "description": "Partition posture. `unsupported` means the platform can partition the accelerator but the row rejects partitioned devices fail-closed; `not_applicable` means the accelerator has no partitioning concept."
        }
      }
    },
    "backend_packages": {
      "type": "array",
      "minItems": 1,
      "description": "Required backend package set and package channel per backend path.",
      "items": {
        "type": "object",
        "additionalProperties": false,
        "required": [
          "backend_path",
          "channel",
          "packages"
        ],
        "properties": {
          "backend_path": {
            "type": "string",
            "minLength": 1,
            "pattern": "^[a-z0-9]+(_[a-z0-9]+)*$"
          },
          "channel": {
            "type": "string",
            "enum": [
              "apt",
              "homebrew"
            ]
          },
          "packages": {
            "type": "array",
            "minItems": 1,
            "items": {
              "type": "string",
              "minLength": 1
            }
          },
          "runner_profiles": {
            "type": "array",
            "description": "Packages a runner profile on this backend path needs beyond `packages`, per profile. Optional; readers also require unique `runner_profile` values within one backend path.",
            "items": {
              "type": "object",
              "additionalProperties": false,
              "required": [
                "runner_profile",
                "packages"
              ],
              "properties": {
                "runner_profile": {
                  "type": "string",
                  "minLength": 1,
                  "pattern": "^[a-z0-9]+(_[a-z0-9]+)*$"
                },
                "packages": {
                  "type": "array",
                  "minItems": 1,
                  "uniqueItems": true,
                  "items": {
                    "type": "string",
                    "minLength": 1
                  }
                }
              }
            }
          }
        }
      }
    },
    "model_class_rows": {
      "type": "array",
      "description": "Pointers to the model support rows valid on this platform row, with their support level. Empty where the row carries no model claim.",
      "items": {
        "type": "object",
        "additionalProperties": false,
        "required": [
          "model_class_row",
          "support_level"
        ],
        "properties": {
          "model_class_row": {
            "type": "string",
            "minLength": 1
          },
          "support_level": {
            "type": "string",
            "enum": [
              "Production",
              "Preview",
              "Experimental",
              "Planned"
            ]
          }
        }
      }
    },
    "gate_semantics": {
      "type": "object",
      "additionalProperties": false,
      "required": [
        "thermal",
        "power",
        "throttle",
        "memory",
        "gpu_utilization"
      ],
      "description": "Posture of every platform signal on this row. Every signal is declared; a signal that is absent on the row is recorded `not_applicable` with a reason rather than omitted.",
      "properties": {
        "thermal": {
          "$ref": "#/definitions/gate"
        },
        "power": {
          "$ref": "#/definitions/gate"
        },
        "throttle": {
          "$ref": "#/definitions/gate"
        },
        "memory": {
          "$ref": "#/definitions/gate"
        },
        "gpu_utilization": {
          "$ref": "#/definitions/gate"
        }
      }
    },
    "support_level": {
      "type": "string",
      "enum": [
        "Production",
        "Preview",
        "Experimental",
        "Planned"
      ],
      "description": "Appliance-lifecycle support level. Planned rows commit their definition so later validation is a harness run, not re-planning; they carry no evidence and are excluded from supported combinations."
    },
    "validation_environment": {
      "type": "object",
      "additionalProperties": false,
      "required": [
        "kind",
        "identity"
      ],
      "properties": {
        "kind": {
          "type": "string",
          "enum": [
            "physical",
            "cloud_instance"
          ],
          "description": "Whether the row's evidence was recorded on physical hardware or on a cloud instance. This participates in matching, not only description: a `physical` row with no `machine_type` matches only a host that reports no machine shape, because evidence recorded in a chassis whose thermals, firmware, and power delivery are the operator's does not transfer to a hypervisor. A `cloud_instance` row with no `machine_type` is how a deliberately chassis-independent claim is expressed and matches any host. Changing this value changes which machines the row matches."
        },
        "identity": {
          "type": "string",
          "minLength": 1,
          "description": "Where the row's claim was validated, as prose: an exact machine type or physical device for a row scoped to one, or a statement of scope for a row whose claim is deliberately broader. Machine-comparable scoping lives in `machine_type`, not here."
        },
        "machine_type": {
          "type": "string",
          "minLength": 1,
          "pattern": "^[a-z0-9]+(-[a-z0-9]+)*$",
          "description": "Exact machine-comparable shape identifier (e.g. a cloud machine type) for rows whose evidence is scoped to one. A row that declares this matches only a host reporting the same value, because evidence does not transfer across machine shapes. Omitting it does NOT make the row match every host: what an omitted value means is decided by `kind` \u2014 see its description. Physical rows are additionally identified by their accelerator matching policy. Must be a value a host probe can actually report, or the row can never match."
        }
      },
      "description": "Where the row's claim was validated. `identity` is prose for humans. The machine-comparable scoping used for matching is `machine_type` together with `kind`: both participate, and an omitted `machine_type` is interpreted according to `kind` rather than as a wildcard."
    },
    "evidence": {
      "type": "object",
      "additionalProperties": false,
      "required": [
        "location"
      ],
      "description": "Where install/upgrade logs, doctor output, smoke results, and telemetry samples for this row are filed. Required on Production rows, forbidden on Planned rows.",
      "properties": {
        "location": {
          "type": "string",
          "minLength": 1
        }
      }
    },
    "provenance": {
      "type": "string",
      "enum": [
        "recorded",
        "spec_authored"
      ],
      "description": "How this row definition was authored. `recorded` means the fields were transcribed from a real run on this exact hardware; `spec_authored` means they were authored from vendor specifications because no evidence run has been recorded for this row yet. Planned rows are always spec_authored and are re-verified against recorded output when their hardware first runs."
    }
  },
  "definitions": {
    "gate": {
      "type": "object",
      "additionalProperties": false,
      "required": [
        "gate"
      ],
      "properties": {
        "gate": {
          "type": "string",
          "enum": [
            "load_bearing",
            "context_only",
            "not_applicable"
          ]
        },
        "reason": {
          "type": "string",
          "minLength": 1,
          "description": "Why the signal is not applicable on this row. Required for `not_applicable`; free-text row fact, not a typed platform reason."
        }
      },
      "allOf": [
        {
          "if": {
            "required": [
              "gate"
            ],
            "properties": {
              "gate": {
                "const": "not_applicable"
              }
            }
          },
          "then": {
            "required": [
              "gate",
              "reason"
            ]
          }
        }
      ]
    }
  },
  "allOf": [
    {
      "if": {
        "required": [
          "support_level"
        ],
        "properties": {
          "support_level": {
            "const": "Production"
          }
        }
      },
      "then": {
        "required": [
          "evidence"
        ]
      }
    },
    {
      "if": {
        "required": [
          "support_level"
        ],
        "properties": {
          "support_level": {
            "const": "Planned"
          }
        }
      },
      "then": {
        "not": {
          "required": [
            "evidence"
          ]
        },
        "properties": {
          "model_class_rows": {
            "maxItems": 0
          },
          "provenance": {
            "const": "spec_authored"
          }
        }
      }
    },
    {
      "if": {
        "not": {
          "required": [
            "accelerator"
          ]
        }
      },
      "then": {
        "properties": {
          "gate_semantics": {
            "properties": {
              "gpu_utilization": {
                "properties": {
                  "gate": {
                    "const": "not_applicable"
                  }
                }
              }
            }
          }
        }
      },
      "$comment": "A row without an accelerator cannot report GPU utilization."
    },
    {
      "if": {
        "required": [
          "accelerator"
        ]
      },
      "then": {
        "properties": {
          "cpu": {
            "properties": {
              "vendors": {
                "maxItems": 1
              }
            }
          }
        }
      },
      "$comment": "An accelerator row names one host CPU vendor."
    },
    {
      "if": {
        "required": [
          "accelerator"
        ],
        "properties": {
          "accelerator": {
            "required": [
              "match_policy"
            ],
            "properties": {
              "match_policy": {
                "const": "family"
              }
            }
          }
        }
      },
      "then": {
        "not": {
          "required": [
            "evidence"
          ]
        },
        "properties": {
          "support_level": {
            "const": "Preview"
          },
          "provenance": {
            "const": "spec_authored"
          },
          "cpu": {
            "properties": {
              "vendors": {
                "const": [
                  "apple"
                ]
              }
            }
          },
          "accelerator": {
            "properties": {
              "family": {
                "const": "Apple M-series"
              },
              "sku": {
                "const": "Apple M-series"
              }
            }
          }
        }
      },
      "$comment": "Family matching is deliberately limited to an evidence-free, spec-authored Apple M-series Preview envelope; hardware evidence belongs to exact rows."
    }
  ]
}
