{
  "schema_version": "0.1",
  "row_id": "ubuntu2404-x86-a100-80g-a2ug1",
  "os": {
    "name": "Ubuntu",
    "version": "24.04"
  },
  "kernel_driver_stack": {
    "components": []
  },
  "cpu": {
    "architecture": "x86_64",
    "vendors": [
      "intel"
    ]
  },
  "accelerator": {
    "family": "NVIDIA A100",
    "sku": "NVIDIA A100-SXM4-80GB",
    "memory_bytes": 85899345920,
    "memory_profile": "discrete_gpu",
    "partitioning": "unsupported"
  },
  "backend_packages": [
    {
      "backend_path": "python_pytorch",
      "channel": "apt",
      "packages": [
        "tensorplate-backend-python-pytorch"
      ]
    }
  ],
  "model_class_rows": [],
  "gate_semantics": {
    "thermal": {
      "gate": "context_only"
    },
    "power": {
      "gate": "context_only"
    },
    "throttle": {
      "gate": "context_only"
    },
    "memory": {
      "gate": "load_bearing"
    },
    "gpu_utilization": {
      "gate": "context_only"
    }
  },
  "support_level": "Preview",
  "provenance": "spec_authored",
  "validation_environment": {
    "kind": "cloud_instance",
    "identity": "GCP a2-ultragpu-1g (disposable), single GPU, non-partitioned",
    "machine_type": "a2-ultragpu-1g"
  }
}
