{
  "schema_version": "0.1",
  "row_id": "ubuntu2404-x86-cpu",
  "os": {
    "name": "Ubuntu",
    "version": "24.04"
  },
  "kernel_driver_stack": {
    "components": []
  },
  "cpu": {
    "architecture": "x86_64",
    "vendors": [
      "amd",
      "intel"
    ]
  },
  "backend_packages": [
    {
      "backend_path": "python_pytorch",
      "channel": "apt",
      "packages": [
        "tensorplate-backend-python-pytorch"
      ]
    }
  ],
  "model_class_rows": [],
  "gate_semantics": {
    "thermal": {
      "gate": "not_applicable",
      "reason": "accelerator-less utility row; host thermal signals are not gated on"
    },
    "power": {
      "gate": "not_applicable",
      "reason": "accelerator-less utility row; no device power domain is measured"
    },
    "throttle": {
      "gate": "not_applicable",
      "reason": "accelerator-less utility row; no accelerator throttle state exists"
    },
    "memory": {
      "gate": "context_only"
    },
    "gpu_utilization": {
      "gate": "not_applicable",
      "reason": "no accelerator is present on this row"
    }
  },
  "support_level": "Preview",
  "provenance": "spec_authored",
  "validation_environment": {
    "kind": "cloud_instance",
    "identity": "Any x86_64 Ubuntu 24.04 host; smoke validated on GitHub-hosted runners"
  },
  "evidence": {
    "location": "dist/release/v0.3.1/ubuntu2404-x86-cpu/"
  }
}
