{
  "schema_version": "0.1",
  "row_id": "ubuntu2404-x86-rtxpro6000we-physical",
  "os": {
    "name": "Ubuntu",
    "version": "24.04"
  },
  "kernel_driver_stack": {
    "components": []
  },
  "cpu": {
    "architecture": "x86_64",
    "vendors": [
      "amd"
    ]
  },
  "accelerator": {
    "family": "NVIDIA RTX PRO Blackwell",
    "sku": "NVIDIA RTX PRO 6000 Blackwell Workstation Edition",
    "memory_bytes": 103079215104,
    "memory_profile": "discrete_gpu",
    "partitioning": "unsupported"
  },
  "backend_packages": [
    {
      "backend_path": "python_pytorch",
      "channel": "apt",
      "packages": [
        "tensorplate-backend-python-pytorch"
      ]
    }
  ],
  "model_class_rows": [],
  "gate_semantics": {
    "thermal": {
      "gate": "load_bearing"
    },
    "power": {
      "gate": "load_bearing"
    },
    "throttle": {
      "gate": "load_bearing"
    },
    "memory": {
      "gate": "load_bearing"
    },
    "gpu_utilization": {
      "gate": "context_only"
    }
  },
  "support_level": "Planned",
  "provenance": "spec_authored",
  "validation_environment": {
    "kind": "physical",
    "identity": "AMD x86_64 workstation (hardware not yet in lab)"
  }
}
